descricao_1,ean_1,titulo_1,url_1,titulo_cb_1,loja_1,descricao_2,ean_2,titulo_2,url_2,titulo_cb_2,loja_2,categoria,match
"Produtos de qualidade para compor sua casa? Conheça as funcionabilidades da Smart TV lg, uma super tela de 75 polegadas para você assistir todos os detalhes de seus filmes, novelas e séries favoritos! Tudo isso com resolução 4K, imagem realista e cores vivas com quatro vezes mais precisão de pixels do que em Full hd. Seus streamings favoritos em um só lugar, com um plus ainda melhor. Além de você poder conectar seus consoles prediletos e aproveitas todos os gráficos e se sentir dentro dos jogos. Gerencie todas as configurações em um mesmo lugar com modos otimizados para vários tipos de jogos: fps, rpg e rts. Controle de contraste com estabilização de preto e branco para melhor visibilidade. Seu design é ideal para qualquer ambiente que você escolher posicionar, sua moldura e tela fina melhoram qualquer decoração. A Inteligência Artificial LG ThinQ vai mudar a sua experiência de TV conectada. Escolha o seu assistente pessoal preferido e controle a sua TV por voz com um novo painel que oferece maior comodidade e controle. é mais comodidade para você poder aproveitar seus momentos de descanso, chega de ficar perdendo o controle! O Smart Magic agora possui uma função nova que conecta com seu smartphone rapidamente, assim você controla tudo direto do celular! Espelhamento de tela, Transmissão de Conteúdo e Compartilhamento de Som. Características Marca: LG Modelo: 75UP8050 Cor da borda: Black Cor da base: Ashed Brown Base: 2 Pole Tela / Imagem Tamanho: 75 polegadas Resolução: 4K uhd Painel: lcd / LED Processador: 5 Gen4 Processor 4K Painel ips dtv HDR10 filmmaker mode Upscaler: 4K Upscaler Áudio Canais: 2.0 Potência (rms): 20 Watts ai Sound ai Acoustic Tuning Surround: Ultra Surround Conexões Entrada hdmi 2.0: 3 Entrada usb: 2 Entrada rf: 1 Saída Digital Óptica: 1 Bluetooth In/Out Funcionalidades Sistema Operacional: webOS 6.0 ThinQ ai Painel de Controle ocf hgig Conteúdos 360 vr Modo Galeria Music Player lg Content Store Miracast Overlay Itens Inclusos 01 Smart TV LG 01 Controle Remoto Smart Magic 01 Cabo de força 01 Kit Parafusos 01 Manual em Português Alimentação Tensão: Bivolt (110 e 220 Volts) Consumo Médio: 225 Watts Frequência: 50/60Hz Consumo Standby: >1 Watts Dimensões Tamanho com base (AxLxP): 102,7 x 167,8 x 36,2 cm Tamanho sem base (AxLxP): 96,4 x 167,8 x 59 cm Tamanho embalagem (AxLxP): 111 x 181,6 x 19,9 cm Peso com base: 32,1 Kg Peso com caixa: 40,3 Kg Garantia: 12 meses",7893299915765,"Smart TV LG 75 4K, Ultra HD LED 75UP8050, ThinQ ai, Wi-fi Integrado",https://www.americanas.com.br/produto/4451942048,"smart tv lg 75 4k, ultra hd led 75up8050, thinq ai, wi-fi integrado",americanas,"Smart TV 4K LG LED UHD 75” Bluetooth, Inteligência Artificial ThinQAI Smart Magic Google Alexa e WiFi - 75UP8050 Características Vídeo Tecnologia: LED Resolução: 4K Tamanho da Tela: 75"" Sistema de Cores: NTSC, PAL-M/N, SBTVD AI Brightness Control 4K Upscaling Filmmaker ModeT Active HDR HGiG Image Enhancing Conexões Wi-Fi Bluetooth Portas de Entrada e Saída HDMI: 04 Entradas HDMI 2.0 USB: 02 Entradas Entrada RF: 01 Saída Digital Optica: 01 Áudio 2.0 Ch. AI Sound AI Acoustic Tuning Clear Voice III Sound Share TV Sound Mode Share Outros Recursos Timer Off Timer On Controle Remoto Sleeptimer Relógio na Tela Processador a5 LG ThinQ AI Magic Google Alexa Google Assistente (Built in) Amazon Alexa (Built in & Works With) Airplay2 & Homekit (Works with) Painel de Controle Sports Alert Processamento Natural de Linguagem AI Recommendation Otimizador de Games LG Channels Edição Inteligente de Apps Media Player EAN 7893299915765 Especificações Técnicas Modelo: 75UP8050PSB Frequência: 60Hz Consumo de Energia: 225 kW/h Potência de Áudio: 20W Garantia: 12 meses Dimensões e Peso Dimensões do Produto sem Embalagem (AxLxP): 964x1678x5999 mm Dimensões do Produto com Embalagem (AxLxP): 111x1816x199 mm Dimensão do Produto com Base (AxLxP): 1027x1678x3622 mm Peso do Produto sem Embalagem: 31,4 kg Peso do Produto com Embalagem: 40,3 kg Peso do Produto com Base: 32,1 kg Itens Inclusos 01 Smart TV 01 Smart Magic 01 Cabo de Força Base Parafusos Manual em português Serviço de Instalação e Orientação de Uso Para sua comodidade e segurança, a Fast Shop dispõe do serviço de Instalação e Orientação de Uso*. Agendamos o serviço para você, executamos a instalação com equipes próprias especializadas e autorizadas pelo fabricante, ensinamos como utilizar os produtos da melhor forma e temos uma área de qualidade para acompanhar e garantir que tudo dê certo. É rápido e fácil. Você pode contratar o serviço com o nosso Televendas pelo tel.: 3003-3278 ou em uma de nossas lojas. Consulte os valores e regiões atendidas. * Verifique com nossos vendedores se a Fast Shop realiza a instalação desse produto.",7893299915765,"Smart TV 4K LG LED UHD 75” Bluetooth, Inteligência Artificial ThinQAI Smart Magic Google Alexa e WiFi - 75UP8050",https://www.amazon.com.br/LG-Bluetooth-Intelig%C3%AAncia-Artificial-ThinQAI/dp/B09BK4PCD8,"smart tv 4k lg led uhd 75” bluetooth, inteligência artificial thinqai smart magic google alexa e wifi - 75up8050",amazon,tvs,1
"Leve muito mais tecnologia para sua casa com a Smart TV 75'' 4K 75NANO75SPA da lg. Saiba Mais! A TV LG NanoCell melhora os detalhes, a definição e a cor para transformar o conteúdo 2K em imagens 4K mais realistas. Desfrute de textos e imagens muito mais nítidos com ruído reduzido e nitidez aprimorada. Confira mais ofertas em Tv e Áudio",7893299915901,"Smart TV 75'' 4K lg, NanoCell, Inteligência Artificial, Al ThinQ Smart Magic Google Alexa, usb, hdmi",https://www.americanas.com.br/produto/4395150168,"smart tv 75'' 4k lg, nanocell, inteligência artificial, al thinq smart magic google alexa, usb, hdmi",americanas,"Interface para instalação de acessórios linha vw Ft-vf-vw4 Aplicação: Nivus 2021 com tela de 10,1 Polo 2018 a 2022 T-cross 2019 a 2020 T-cross 2021 com tela de 10,1 T-cross 2021 com tela de 6,5 Virtus 2018 a 2021 Virtus 2022 com tela de 10,1 Virtus 2022 com tela de 6,5 Neste kit segue: 1 interface de vídeo 1 receptor de tv full hd 1 módulo de espelhamento A interface ft-vf-vw4 é a interface de vídeo que adiciona novas possibilidades a multimídia original do volkswagem polo, virtus, t-cross e nivus.Tudo isso com instalação plug and play que mantém a originalidade do veículo. Ft-tv-hd3 A nova tv digital full hd ft-tv-hd3 chegou para você confundir o banco do carro com o sofá da sua casa. Com melhor qualidade de imagem e recepção de sinal, sua família não irá perder uma notícia importante ou o final da novela a caminho de casa. Possui saída para telas traseiras e entrada usb que permite reprodução de mídias e atualização remota. Produto com total integração com as interfaces de vídeo faaftech. Conheça a tv digital full hd ft-tv-hd3 e veja o conteúdo como ele deve ser visto. Ft-smartmirror Espelhe a tela de seu celular na tela de vídeo do painel de seu veículo. Facilidade de navegação com seu gps favorito, ouça suas músicas do celular, spotify entre outros, compartilhe os desenhos ou clipe favorito para sua família no youtube entre outras diversas funções. O espelhamento de tela é compatível com smartphones ios e android, desde que estes possuam a função screen mirroring ou similar. App netflix não compatível com sistema ios Especificações: Função vim (usb) Habilita 2 entradas av Habilita entrada para câmera traseira Habilita entrada para câmera frontal Comandos para tv e dvd no volante Integração de áudio por fm ou ativação da entrada auxiliar original do veículo Opção para desabilitar gráfico do sensor de estacionamento nos carros com tela de 10,1 Saídas auxiliares 12v acc e câmera Conexões plug and play - mantém a originalidade do veículo Atualização via usb - permite atualização remota do produto Observações: apenas para o veículo nivus utilizando câmera frontal perde-se 1 entrada av ativação compatível nos veículos com tela de 8 polegadas Navegação via gps não funcionará corretamente durante a utilização das entradas av Ícones e aviso de câmera ficarão visíveis nas entradas av Aso o veículo não tenha câmera original será necessário instalar Itens inclusos: Interface de vídeo ft-vf-vw4 1 receptor de tv full hd 1 módulo de espelhamento Chicote plug and play Manual Marca: faaftech Garantia: 12 meses pelo fabricante Não nos responsabilizamos por nenhum dano ocasionado pela instalação do produto por um profissional não qualificado, sendo assim de total responsabilidade do proprietário Todas as informações divulgadas são de responsabilidade do fabricante / fornecedor. Verifique com os fabricantes do produto e de seus componentes eventuais limitações à utilização de todos os recursos e funcionalidades.",7892460096951,Tv Digital Full Hd E Espelhamento Vw Virtus 2022 Faaftech F,https://www.americanas.com.br/produto/5200803633,tv digital full hd e espelhamento vw virtus 2022 faaftech f,americanas,tvs,0
"Características do Produto: Modelo: OLED55A1PSAMarca: LGCor: PretoAltura: 122,8 cmLargura: 70,6 cmComprimento: 4,69 cmPeso: 18,7 KgTamanho da Tela: 55""Resolução da Tela: 4KAlto-Falantes: SimFunção Gamer: NãoConexões: hdmi e USBImagem: Painel OLEDPixels que se AutoiluminamPreto Puro – Contraste InfinitoCores Perfeitas ( + 1Bi de Cores)Eye Comfort DisplayProcessador ai 7 Gen4AI PictureAI Brightness Seleção Automática de GêneroAI UpscalingDolby Vision iq / filmmaker MODETMCinema hdr / HFRHGiGImage EnhancingDouble Step Noise ReductionAdvanced Color EnhancerTrue Color Accuracy (17x17x17)Som:2.0 Ch. / 20WDolby AtmosAI SoundBluetooth Surround ReadyAI Acoustic TuningWiSA SpeakersClear Voice IIISound ShareTV Sound Mode Sharee-ARC (hdmi 3)AI & Smart: LG ThinQ AIGoogle Assistante (Built in)Amazon Alexa (Built in & Works With)Airplay2 & Homekit (Works with)Painel de ControleSports AlertProcessamento Natural de LinguagemAI RecommendationControle Smart MagicOtimizador de GamesLG ChannelsEdição Inteligente de AppsMedia PlayerConexões:3 Entradas hdmi 2.02 Entradas USB1 Entrada RF1 Saída Digital OpticaDimensões do Produto (AxLxC): Com Base: 122,8 x 76,7 x 27,1 cmPeso: 18,4 KgSem Base: 122,8 x 70,6 x 4,69 cmPeso: 18,7 KgDimensões do Produto (Embalado): (AxLxC): 135,3 x 80,3 x 17,1 cmPeso: 23,7 KgGarantia: 1 ano (Ofertado pelo fabricante)Fornecedor: LG",7893299916014,"Smart TV oled 55 LG OLED55A1PSA, 4K, Wi-Fi, Bluetooth, com 2 usb, 3 hdmi, 60Hz",https://www.americanas.com.br/produto/4880314074,"smart tv oled 55 lg oled55a1psa, 4k, wi-fi, bluetooth, com 2 usb, 3 hdmi, 60hz",americanas,Todas as informações divulgadas são de responsabilidade do fabricante/fornecedor.Verifique com os fabricantes do produto e de seus componentes eventuais limitações à utilização de todos os recursos e funcionalidades.Imagens Meramente Ilustrativas.,7892509117524,"Samsung Smart TV 65"" Neo QLED 4K 65QN90A Mini Led Painel 120hz Processador IA Som em Movimento Plus Tela sem limites Design slim Alexa built in",https://www.americanas.com.br/produto/3060874076,"samsung smart tv 65"" neo qled 4k 65qn90a mini led painel 120hz processador ia som em movimento plus tela sem limites design slim alexa built in",americanas,tvs,0
"atenção: Esse produto não pode ser faturado para cnpj. Pedimos a gentileza de efetuar a compra com um cpf! tv Android Led 50"" fhd 1920x1080 Philco Bivolt PTV50D60SA Características: - A TV Philco Android Led 50'' PTV50D60SA também é smart TV com loja de aplicativos, ou seja, os aplicativos favoritos de toda a família podem ser baixados diretamente no televisor, reunindo jogos, filmes e séries em um só lugar! - Com recurso Midiacast, que garante comunicação sem fio entre dispositivos móveis (compatíveis); - Oferece entrada hdmi, assim você pode assistir aos seus filmes prediletos em alta qualidade; - Com processador Quad-core 850MHz, maior velocidade e resposta para seu televisor! Especificações Técnicas: - Marca: Philco - Ref: 99503008 - Polegadas: 50 - 3D: Não - Voltagem (v): Bivolt - Android: Sim - Tipo de tela: led - Entradas: usb, hdmi, Áudio rca - Quantidade de entradas usb: 2 - Quantidade de entradas hdmi: 2 - Wireless Integrado: Sim - Nivelador Automático de Volume: Sim - Equalização de Som: Sim - Cor: Preto - Ajuste de Temperatura de Cor: Sim - Tempo de Resposta (ms): 8 Ms - Formato: 16:9 - Ângulo de Visão: 178° - Sistema de Cores: pal-m, pal-n e ntsc - Velocidade de Painel: 60 Hz - Contraste: 500.000:1 (Dinâmico) - Funções: Mute, Sleep, Closed Caption, Guide, Info, Bloqueio, Zoom, dnr - TV Backlight d-led 50'' - Resolução: fhd (1920 x 1080) - Tempo de resposta: 8.0ms - Ângulo de Visão: 178°(H) x 178°(V) - Brilho: 240 cd/m² - Contraste dinâmico: 5.000.000:1 - Frequência da Tela: 60Hz - Potência do Alto-Falante: 10Wrms x 2 - Processador (cpu): Quad Core 850MHz - Gráfico (gpu): Dual Core SGX544MP2 - Formato da Tela: 16:9 - Sistema de cores: pal-m, pal-n, ntsc - Furação Vesa: 400x200mm conexões: - Entrada de vídeo e áudio estéreo (rca) - Entrada vídeo componente (rca) - 2 Entradas hdmi - Saída de áudio digital coaxial (rca) - Entrada rf para TV aberta (Digital e Analógica) e TV a cabo - 2 Entradas USB 2.0: reproduz filmes, músicas e fotos - Entrada lan (RJ45)¹ - Saída de áudio analógico (P2) - Dispositivo wireless integrado - Conversor digital integrado - Recepção em atv, dtv e catv - Menu nos idiomas Português e Inglês - Busca automática de canais - Equalizadores de som e imagem predefinidos - Ajustes de temperatura de cor - Nivelador automático de volume - Recursos: mute MTS² sleep closed caption dnr GUIDE² INFO² bloqueio de canal zoom T-LINK(7) (hdmi-cec). - Função MIDIACAST³: Comunicação sem fios entre dispositivos móveis (smartphones e tablets) e HDTVs Dimensão do Produto: - Largura: 112,5 cm - Altura: 65,2 cm - Profundidade: 7,5 cm - Peso Líquido: 10.84 Kg Aviso: Imagem meramente ilustrativa. Todas as informações divulgadas são de responsabilidade do fabricante. Garantia: 12 meses",7899466429813,TV Android Led 50 fhd 1920x1080 Philco Bivolt PTV50D60SA,https://www.americanas.com.br/produto/1240880027,tv android led 50 fhd 1920x1080 philco bivolt ptv50d60sa,americanas,"TV digital portátil de 12 polegadas, 1280 x 800 HD HDMI 16: 09 tela TV digital, tela TFT LED colorida, suporte porta USB, slot para cartão de memória/MMC, conteúdo de unidade de disco U para reprodução, MKV, MOV, AVI, WMV, MP4 ",9130974886773,"TV digital portátil de 12 polegadas, 1280 x 800 HD HDMI 16:09, tela digital TFT-LED colorida, suporta porta USB, compartimento de cartão de memória/MMC, conteúdo de unidade de disco reproduza U, MKV, MOV, AVI, WMV, MP4 (regulamentos dos EUA)",https://www.amazon.com.br/digital-port%C3%A1til-polegadas-1280-HDMI/dp/B098B4MFZ3,"tv digital portátil de 12 polegadas, 1280 x 800 hd hdmi 16:09, tela digital tft-led colorida, suporta porta usb, compartimento de cartão de memória/mmc, conteúdo de unidade de disco reproduza u, mkv, mov, avi, wmv, mp4 (regulamentos dos eua)",amazon,tvs,0
Smart tv 55 samsung un55au7700 crystal uhd 4k 3hdmi 1usb cinza Descubra produtos úteis para você Os produtos foram projetados com o usuário em mente querendo cumprir os desejos,7892509117913,SMART TV 55 SAMSUNG UN55AU7700 CRYSTAL UHD 4K 3HDMI 1USB CINZA,https://www.amazon.com.br/SMART-SAMSUNG-UN55AU7700-CRYSTAL-3HDMI/dp/B09DTL4BGW,smart tv 55 samsung un55au7700 crystal uhd 4k 3hdmi 1usb cinza,amazon,Todas as informações divulgadas são de responsabilidade do fabricante/fornecedor.Verifique com os fabricantes do produto e de seus componentes eventuais limitações à utilização de todos os recursos e funcionalidades. Imagens Meramente Ilustrativas.,7892509117913,"Smart TV 55"" UHD Samsung 4k 55AU7700 Processador Crystal 4k Tela Sem Limites Visual Livre de Cabos Alexa Built In",https://www.americanas.com.br/produto/3069509622,"smart tv 55"" uhd samsung 4k 55au7700 processador crystal 4k tela sem limites visual livre de cabos alexa built in",americanas,tvs,1
"A Smart TV Philco LED 4K 70"" PTV70Q50SNSG foi pensada para quem procura conectividade, qualidade de som e acima de tudo, qualidade de imagem, assim é a Nova Geração de TVs Philco. Ela é Dolby Audio e 4K Real, cores em sua plenitude sem pontos brancos. Possui processador Quad Core e processador gráfico Triple Core, isso significa alta velocidade para conteúdos e gráficos mais complexos. Smart, com dispositivo wireless integrado, garante interatividade em um só click. Com aplicativos, como NETFLIX, Globo Play, proporcionam diversão para toda família. Assista novelas, filmes, séries e grandes clássicos a qualquer hora. Não é só uma televisão, é mais tecnologia na sua casa! TV Backlight D-LED 70"" Resolução: UHD (3840 X 2160) Tempo de resposta: 8.0 ms Ângulo de Visão: 170°(H) x 170°(V) Brilho: 280 cd/m² Contraste dinâmico: 4.000.000:1 Frequência da Tela: 60Hz Potência do Alto-Falante: 12Wrms x 2 Formato da Tela: 16:9 Sistema de cores: PAL-M, PAL-N, NTSC Furação Vesa: 400x200mm CONEXÕES: Entrada de vídeo e áudio estéreo (RCA) 3 entradas HDMI 2.0 e 1 entrada HDMI (ARC)² Entrada RF para TV aberta (Digital e Analógica) e TV à cabo 2 entrada USB 2.0: reproduz filmes, músicas e fotos 1 entrada S/PDIF out Optical 1 entrada Ethernet 1 entrada P2: Para fones e amplificadores Menu nos idiomas Português e Inglês Busca automática de canais Recepção em ATV, DTV e CATV Conversor digital integrado Equalizadores de som e imagem predefinidos Ajustes de temperatura de cor Nivelador automático de volume SDR para HDR: corrige imagem para melhor performance Recursos: MUTE | MTS¹ | SLEEP | BROWSER | APP STORE | HDR | CLOSED CAPTION | DNR | GUIDE¹ | INFO¹ | BLOQUEIO DE CANAL | RELÓGIO | ZOOM | PVR¹ | HDMI ARC² | T-LINK² (HDMI-CEC). 1- Disponível apenas para transmissões em ISDB-T (TV Digital). 2- O dispositivo conectado deve ser compatível com a função. Recurso talvez não funcione com dispositivos de algumas marcas.",7899466434947,"Smart TV Philco LED 4K 70"" PTV70Q50SNSG - Netflix",https://www.americanas.com.br/produto/1403562534,"smart tv philco led 4k 70"" ptv70q50snsg - netflix",americanas,"A Smart TV Samsung UN60BU8000 possui ótimas funcionalidades e você vai se apaixonar por pelas suas facilidades e suas novas tecnologias. Com o processador Crystal 4K todos os seus programas, jogos, séries e filmes vão ficar com uma imagem muito mais nítida e com cores ainda mais brilhantes, esse processador transforma tudo a que você assiste em resolução próxima à 4K. Desfrute de uma imagem mais natural e detalhada com essa tecnologia inovadora, que analisa as regiões da tela e ajusta automaticamente o contraste. E com o hdr o alcance dos níveis de luz na sua tv, proporcionando mais brilho, contraste e detalhes para você aproveitar o seu programa favorito tanto nas cenas mais escuras, quanto naquelas de alta luminosidade. Seu som é otimizado no espaço para você vivenciar uma experiência única de som potencializada de acordo com o ambiente da sua casa, independente se a TV estiver colocada na parede ou no rack Traga suas experiências para um único lugar, com o Video Call App você vai conseguir conectar sua videochamada à TV para conversar com seus amigos e família uma tela grande! E ainda mais tecnologia para você aproveitar o Controle Remoto é moderno e ecológico, é produzido com quase um terço de plástico reciclável e ainda é recarregável por energia solar, pela própria luz do ambiente da sua casa ou por usb, assim você vai evitar o desperdício de milhões de pilhas ao longo dos anos. Características Marca: Samsung Ref.: UN60BU8000GXZD Cor: Preto Tela / Imagem Tamanho da tela: 60 polegadas Processador: Crystal 4K Tipo de produto: LED Resolução: 4K uhd - 3,840 x 2,160 Frequência do Painel: 60 Hz Conexões hdmi: 3 usb: 2 Entrada de rf (terrestre/entrada de cabo): 1 Saída de Áudio Digital (Óptica): 1 Ethernet (lan) hdmi A / Return Ch. Support hdmi Quick Switch Wi Fi (WiFi5) Anynet + (hdmi-cec) eARC Bluetooth (bt 5.2) Funções Smart Sistema Operacional: Tizen Navegador (Web Browser) Alexa Integrado Bixby Google Assistent Integrado tv Plus SmartThings (Wi-Fi) Bixby: Inglês americano, Inglês britânico, Inglês indiano, Coreano, Francês, Alemão, Italiano, Espanhol, Português do Brasil. Características variam de acordo com região Áudio Dolby Digital Plus: ms 12 2 canais Potência (rms): 20 Watts Tipo de alto-falante: 2 Canais Som em Movimento Virtual Bluetooth de Áudio Sincronia Sonora Vídeo Refresh Rate: 60Hz pqi (Picture Quality Index): 2200 hdr hdr 10 + hlg Mega Contraste Tecnologia do Painel: Dynamic Crystal Color Micro Dimming: Esmaecimento uhd Contrast Enhancer Auto Motion Plus Modo Filme Convergência Espelhamento do Smartphone para dlna Tap View WiFi Direct Casting para alguns apps Configuração fácil Som da TV para Smartphone Bluetooth Low Energy Espelhamento de Áudio Sintonizador Sintonizador analógico: Sim (Trinorma) Digital Broadcasting: isdb-t Data Broadcasting: ginga Recursos Som adaptativo Detecção de brilho e cor Upscaling básico Acessibilidade - Guia de voz: Inglês (eua), Espanhol (México), Português (Brasil) Acessibilidade - Menu Aprendizado: Inglês (eua), Espanhol (México), Português (Brasil) Acessibilidade – Outros: Ampliar / Alto contraste / Inversão de cor / Tons de cinza / Zoom em linguagem de sinais / Áudio de múltiplas saídas / Repetição lenta de botão Busca automática de canais Desligamento automático Connect Share (hdd) ConnectShare (usb 2.0) Legenda epg Wireless Dex Web Service: Microsoft 365 Modo Filmmaker Compatível com hid USB bt hid integrado Compatível com hid USB IPv6 Support Suporte para mbr Design Design: AirSlim Tipo de Borda: 3 Bezel-less Espessura: Fina Tipo de Suporte: Pés finos Visual livre de cabos: Sem canaletas traseiras Itens Inclusos 01 Smart TV 01 Controle Remoto TM2280E 01 Cabo de Força 01 Manual Eletrônico 01 Manual do Usuário Alimentação Tensão: Bivolt (110 Volts e 220 Volts) Frequência: 50/60 Hz Consumo de energia máximo: 165 Watts Selo Procel: A Dimensões Tamanho sem suporte (AxLxP): 77,6 x 135,3 x 25,7 cm Tamanho com suporte (AxLxP): 81,4 x 135,3 x 28,1 cm Tamanho embalagem (AXLxP): 90,6 x 151 x 15,8 cm Peso com embalagem: 25,2 Kg Peso do conjunto com suporte: 19 Kg Peso do conjunto sem suporte: 18,6 Kg Garantia: 12 meses *NÃO faturamos para cnpj",7892509121958,"Smart TV Samsung 60, Ultra HD UN60BU8000, Wi-Fi Integrado",https://www.americanas.com.br/produto/5018316097,"smart tv samsung 60, ultra hd un60bu8000, wi-fi integrado",americanas,tvs,0
"Experimente o melhor da tecnologia com a Smart 55"" UHD da LG, ela oferece tela de LED e resolução 4K UHD de 3840x2160 pixels obtendo uma incrível experiência de imagem, possui três entradas HDMI e duas USB, proporcionando mais possibilidades de conexão. Acompanha compatibilidade com o sistema de Inteligência Artificial ThinQ Al, conta com Bluetooth, sistema operacional webOS 5.0, Music Player, LG Content Store, painel de controle, conteúdos VR 360, miracast overlay, HDR10 e potência de som de 20W. Acesse aos aplicativos Netflix e Youtube, graças a conexão Smart, navegue na internet conectando-se diretamente a rede Wi-Fi. Além disso, seu design arrojado e diversos modos predefinidos de imagem fazem da Smart 55"" uma TV elegante e eficiente",7893299914379,"Smart TV LED 55"" 4K UHD LG 55UN731C, 3 HDMI, 2 USB, Wi-Fi, Assistente Virtual e Bluetooth",https://www.amazon.com.br/LG-55UN731C-Assistente-Virtual-Bluetooth/dp/B08FJC83S4,"smart tv led 55"" 4k uhd lg 55un731c, 3 hdmi, 2 usb, wi-fi, assistente virtual e bluetooth",amazon,"Smart TV LG 55'' 4K, UHD, Wi-Fi, Bluetooth, HDR, Inteligência Artificial ThinQ AI, Google Assistente, Alexa",7893299914379,"Smart TV 55"" LG 55UN731C 4K UHD 3 HDMI 2 USB Wi-Fi Assitente Virtual Bluetooth",https://www.americanas.com.br/produto/1902702378,"smart tv 55"" lg 55un731c 4k uhd 3 hdmi 2 usb wi-fi assitente virtual bluetooth",americanas,tvs,1
