descricao_1,ean_1,titulo_1,url_1,titulo_cb_1,loja_1,descricao_2,ean_2,titulo_2,url_2,titulo_cb_2,loja_2,categoria,match
"atenção: Esse produto não pode ser faturado para cnpj. Pedimos a gentileza de efetuar a compra com um cpf! tv Android Led 50"" fhd 1920x1080 Philco Bivolt PTV50D60SA Características: - A TV Philco Android Led 50'' PTV50D60SA também é smart TV com loja de aplicativos, ou seja, os aplicativos favoritos de toda a família podem ser baixados diretamente no televisor, reunindo jogos, filmes e séries em um só lugar! - Com recurso Midiacast, que garante comunicação sem fio entre dispositivos móveis (compatíveis); - Oferece entrada hdmi, assim você pode assistir aos seus filmes prediletos em alta qualidade; - Com processador Quad-core 850MHz, maior velocidade e resposta para seu televisor! Especificações Técnicas: - Marca: Philco - Ref: 99503008 - Polegadas: 50 - 3D: Não - Voltagem (v): Bivolt - Android: Sim - Tipo de tela: led - Entradas: usb, hdmi, Áudio rca - Quantidade de entradas usb: 2 - Quantidade de entradas hdmi: 2 - Wireless Integrado: Sim - Nivelador Automático de Volume: Sim - Equalização de Som: Sim - Cor: Preto - Ajuste de Temperatura de Cor: Sim - Tempo de Resposta (ms): 8 Ms - Formato: 16:9 - Ângulo de Visão: 178° - Sistema de Cores: pal-m, pal-n e ntsc - Velocidade de Painel: 60 Hz - Contraste: 500.000:1 (Dinâmico) - Funções: Mute, Sleep, Closed Caption, Guide, Info, Bloqueio, Zoom, dnr - TV Backlight d-led 50'' - Resolução: fhd (1920 x 1080) - Tempo de resposta: 8.0ms - Ângulo de Visão: 178°(H) x 178°(V) - Brilho: 240 cd/m² - Contraste dinâmico: 5.000.000:1 - Frequência da Tela: 60Hz - Potência do Alto-Falante: 10Wrms x 2 - Processador (cpu): Quad Core 850MHz - Gráfico (gpu): Dual Core SGX544MP2 - Formato da Tela: 16:9 - Sistema de cores: pal-m, pal-n, ntsc - Furação Vesa: 400x200mm conexões: - Entrada de vídeo e áudio estéreo (rca) - Entrada vídeo componente (rca) - 2 Entradas hdmi - Saída de áudio digital coaxial (rca) - Entrada rf para TV aberta (Digital e Analógica) e TV a cabo - 2 Entradas USB 2.0: reproduz filmes, músicas e fotos - Entrada lan (RJ45)¹ - Saída de áudio analógico (P2) - Dispositivo wireless integrado - Conversor digital integrado - Recepção em atv, dtv e catv - Menu nos idiomas Português e Inglês - Busca automática de canais - Equalizadores de som e imagem predefinidos - Ajustes de temperatura de cor - Nivelador automático de volume - Recursos: mute MTS² sleep closed caption dnr GUIDE² INFO² bloqueio de canal zoom T-LINK(7) (hdmi-cec). - Função MIDIACAST³: Comunicação sem fios entre dispositivos móveis (smartphones e tablets) e HDTVs Dimensão do Produto: - Largura: 112,5 cm - Altura: 65,2 cm - Profundidade: 7,5 cm - Peso Líquido: 10.84 Kg Aviso: Imagem meramente ilustrativa. Todas as informações divulgadas são de responsabilidade do fabricante. Garantia: 12 meses",7899466429813,TV Android Led 50 fhd 1920x1080 Philco Bivolt PTV50D60SA,https://www.americanas.com.br/produto/1240880027,tv android led 50 fhd 1920x1080 philco bivolt ptv50d60sa,americanas,"Deixe a Smart TV LED 50"" Philco PTV50D60SA FULL HD Conversor Digital Integrado 2 HDMI 2 USB Wi-Fi fazer parte da sua vida, com ela ver as séries, filmes e programas que você gosta será ainda mais divertido. Tudo isso por meio da loja de aplicativos, ou seja, os aplicativos favoritos de toda a família podem ser baixados diretamente no televisor, reunindo jogos, filmes e séries em um só lugar! Com cores vivas e vibrantes sua experiência à frente da TV será de tirar o fôlego, a qualidade da imagem é incrível e você não vai perder nenhum detalhe. Com recurso Midiacast, que garante comunicação sem fio entre dispositivos móveis seus ambientes estarão sempre bem organizados. Oferece entrada HDMI, assim você pode assistir aos sempre em alta qualidade. Com processador Quad-core 850MHz, maior velocidade e resposta para seu televisor! Tudo isso com um design sem igual que deixará qualquer ambiente ainda mais funcional, moderno e cheio de atitude. Imagens meramente ilustrativas.Todas as informações divulgadas são de responsabilidade do Fabricante/Fornecedor.Verifique com os fabricantes do produto e de seus componentes eventuais limitações à utilização de todos os recursos e funcionalidades.Certas funções necessitam de conexão com a internet. Alguns aplicativos podem requerer uma assinatura para acesso, sujeito a cobrança.",7899466429813,"Smart TV LED 50"" Philco PTV50D60SA FULL HD Conversor Digital Integrado 2 HDMI 2 USB Wi-Fi",https://www.americanas.com.br/produto/134322540,"smart tv led 50"" philco ptv50d60sa full hd conversor digital integrado 2 hdmi 2 usb wi-fi",americanas,tvs,1
"Samsung Smart TV 65"" Crystal UHD 4K 65AU8000, Painel Dynamic Crystal Color, Design slim, Tela sem limites, Visual Livre de Cabos, Alexa built in, Controle Único",7892509117395,"Samsung Smart TV 65"" Crystal UHD 4K 65AU8000, Painel Dynamic Crystal Color, Design slim, Tela sem limites, Visual Livre de Cabos, Alexa built in, Controle Único",https://www.amazon.com.br/Samsung-Crystal-65AU8000-Dynamic-Controle/dp/B095DWMZ73,"samsung smart tv 65"" crystal uhd 4k 65au8000, painel dynamic crystal color, design slim, tela sem limites, visual livre de cabos, alexa built in, controle único",amazon,Como usar: ,7350617055973,"BTER TV portátil de 15,5 polegadas, TV digital widescreen 1080p compatível com DVB-T/T2 Color TFT LED TV com bateria de 1800 mAh, vídeo MP3, USB, compartimento para cartão SD, MKV, MOV, AVI, WMV, MP4, FLV, MPEG4-1, controle remoto",https://www.amazon.com.br/BTER-polegadas-widescreen-compat%C3%ADvel-compartimento/dp/B09VF5G4LJ,"bter tv portátil de 15,5 polegadas, tv digital widescreen 1080p compatível com dvb-t/t2 color tft led tv com bateria de 1800 mah, vídeo mp3, usb, compartimento para cartão sd, mkv, mov, avi, wmv, mp4, flv, mpeg4-1, controle remoto",amazon,tvs,0
"32"" Smart TV Panasonic LED JS500 - Bluetooth audio Link, LED, Espelhamento de aplicativos",7896067213445,"32"" Smart TV Panasonic LED JS500",https://www.amazon.com.br/32-Smart-Panasonic-LED-JS500/dp/B09JKTH8H4,"32"" smart tv panasonic led js500",amazon,"Você merece ter uma Smart TV de alta qualidade na sua casa para assistir os filmes, séries e a programação preferida, e a Smart TV 32'' Panasonic TC-32JS500B é a melhor opção. Com 32"" conta com resolução HD e taxa de atualização de 60Hz, seu design é moderno e vai combinar perfeitamente na sua sala, quarto ou qualquer outro lugar que desejar. Grande variedade de Aplicativos Acesse vídeos, filmes, aplicativos e navegue na internet com a sua nova Smart TV com qualidade LED da Panasonic. Os seus aplicativos favoritos, como Netflix, YouTube, Globoplay, Prime Video, Deezer, KidsFlix, entre outros disponíveis na loja de aplicativos. Espelhamento Aproveite ainda mais seus games, aplicativos, fotos, músicas e vídeos e reproduza conteúdos com o espelhamento (Mirroring). Imagens meramente ilustrativas.Todas as informações divulgadas são de responsabilidade do Fabricante/Fornecedor.Verifique com os fabricantes do produto e de seus componentes eventuais limitações à utilização de todos os recursos e funcionalidades.Certas funções necessitam de conexão com a internet. Alguns aplicativos podem requerer uma assinatura para acesso, sujeito a cobrança.",7896067213445,Smart TV 32'' Panasonic TC-32JS500B HD com Conversor Digital 2 HDMI 2 USB Preta,https://www.americanas.com.br/produto/3856274973,smart tv 32'' panasonic tc-32js500b hd com conversor digital 2 hdmi 2 usb preta,americanas,tvs,1
Características,7892509117579,"Smart TV Samsung QLED 4K 65Q70A Design Slim Modo Game Som em Movimento Virtual Tela Sem Limites 65"" 65""",https://www.amazon.com.br/Samsung-65Q70A-Movimento-Virtual-Limites/dp/B09QW3PKGC,"smart tv samsung qled 4k 65q70a design slim modo game som em movimento virtual tela sem limites 65"" 65""",amazon,"Características Vídeo Tecnologia: FreeSync Premium Pro Resolução: qled 4K (3840 x 2160) Tamanho da Tela: 65"" Sistema Operacional: Plataforma Tizen Processador Quantum 4K com ia Conexões Wi-Fi Bluetooth Portas de Entrada e Saída 04 Entradas hdmi 02 Entradas USB Outros Recursos Timer Sleeptimer Tela Ultra-Wide Pontos Quânticos Modo Game Menu de Jogos Som em movimento virtual Sincronia Sonora Alexa built in Motion Xcelarator Turbo Design Slim ean 7892509117579 Cor Preto Especificações Técnicas Modelo: QN65Q70AAGXZD Frequência: 60 Hz Consumo de Energia: 250 kW/h Selo Procel (Eficiência Energética): A Garantia: 12 meses Dimensões e Peso Dimensões do Produto sem Embalagem (AxLxP): 832,2x1451,7x25,7 mm Dimensões do Produto com Embalagem (AxLxP): 950x1612x164 mm Dimensão do Produto com Base (AxLxP): 832,2x1451,7x25,7 mm Peso do Produto sem Embalagem: 20,6 kg Peso do Produto com Embalagem: 20,6 kg Peso do Produto com Base: 28,8 kg Itens Inclusos 01 Smart TV 01 Controle remoto único 01 Cabo de força Manual do usuário Serviço de Instalação e Orientação de Uso Para sua comodidade e segurança, a Fast Shop dispõe do serviço de Instalação e Orientação de Uso*. Agendamos o serviço para você, executamos a instalação com equipes próprias especializadas e autorizadas pelo fabricante, ensinamos como utilizar os produtos da melhor forma e temos uma área de qualidade para acompanhar e garantir que tudo dê certo. é rápido e fácil. Você pode contratar o serviço com o nosso Televendas pelo tel.: 3003-3278 ou em uma de nossas lojas. Consulte os valores e regiões atendidas. * Verifique com nossos vendedores se a Fast Shop realiza a instalação desse produto.",7892509117579,"Smart TV 4K Samsung qled 65 com Design Slim, Alexa built in e Wi-Fi - QN65Q70AAGXZD",https://www.americanas.com.br/produto/3439073089,"smart tv 4k samsung qled 65 com design slim, alexa built in e wi-fi - qn65q70aagxzd",americanas,tvs,1
Todas as informações divulgadas são de responsabilidade do fabricante/fornecedor.Verifique com os fabricantes do produto e de seus componentes eventuais limitações à utilização de todos os recursos e funcionalidades.Imagens Meramente Ilustrativas.,7893299911781,Smart TV Oled 65'' LG OLED65B9 HDR Ativo com Dolby Vision e Dolby Atmos 4 HDMI 3 USB Wi-Fi com Inteligência Artificial Controle Smart Magic,https://www.americanas.com.br/produto/134450904,smart tv oled 65'' lg oled65b9 hdr ativo com dolby vision e dolby atmos 4 hdmi 3 usb wi-fi com inteligência artificial controle smart magic,americanas,"Smart Tv Led Crystal é para quem gosta de se sentir no cinem50 polegadas para toda a família assistir filmes, séries é só colocar a pipoca pra estourar e aproveitar! A Crystal uhd é a tela mais fina da categoria além disto visual livre de cabos, seu ambiente ficará clean evitando muitos cabos aparentes: a Crystal uhd apresenta uma solução de canaletas exclusiva que permite organizar os cabos e escondê-los. Conexão Bluetooth: Conexão sem fio entre sua TV e outros aparelhos mais conexão e menos fios. Aproveite a praticidade da conexão sem fio entre a sua TV e outros aparelhos e conecte-se para ouvir música, assistir conteúdos e muitos mais. Processador Crystal uhd com cores mais apuradas, graças essa tecnologia entrega uma imagem mais realista e uma imersão em cores e contraste. Tão perfeita quanto às imagens reproduzidas, a Crystal uhd da Samsung foi pensada em todos os ângulos.CARACTERÍSTICAS:- Marca: Samsung- Modelo: LH50BEAHVGGXZDESPECIFICAÇÕES:- Polegadas: 50""- Wi-Fi: Integrado- Resolução: 4K 3840 x 2160- Tipo de tela: 4K- hmdi: 3- USB: 1- Sistema Operacional: Tizen- Peso: 11 kg- Dimensões do produto: 111,68 x 64,42 x 5,99 cm- Recursos: Smart Crystal Modo Hotel.conteúdo da embalagem:- Smart TV 50"" Led Crystal Ultra HD 4K- Controle Remoto- Manual do Usuário- Cabo de Alimentação.Garantia do Fornecedor12 mesesPeso:12000 gramas (bruto com embalagem)",7892509118132,"Smart TV Samsung 50 led, Crystal Ultra HD 4K, Wi-Fi, USB - LH50BEAHVGGXZD",https://www.americanas.com.br/produto/3457012280,"smart tv samsung 50 led, crystal ultra hd 4k, wi-fi, usb - lh50beahvggxzd",americanas,tvs,0
"Modelo: AU7700GXZD O processador Crystal 4K transforma tudo o que você assiste em resolução próxima à 4K. Com uma exclusiva tela sem bordas aparentes, a TV destaca apenas as imagens que você quer ver, e nada mais. Multiplos Assistentes de voz - Uma maneira inteligente de comandar sua TV por voz Controle sua TV por voz em português: acesse apps, mude de canal ou altere o volume. A TV traz Bixby, Assistente Virtual e Google Assistant integrados para você escolher o seu serviço de voz preferido. Com a TV Samsung você aproveita não apenas da melhor qualidade de imagem mas também curte no conforto da sua casa diferentes atividades como: acesso a canais gratuitos, acesso remoto ao seu PC e muito mais. Aproveite! Tap View - Espelhamento entre celular e TV com apenas 1 toque Encoste seu Smartphone na TV e veja o conteúdo do seu celular automaticamente espelhado na tela grande para compartilhamento de fotos, vídeos e apresentações. Controle Remoto Único - Um controle e nada mais Aquela confusão de controles no seu ambiente acabou. O exclusivo Controle Remoto Único reconhece todos os aparelhos compatíveis conectados a TV e passa a controlá-los também. Controle remoto com plástico reciclável - Reduz o impacto no meio ambiente Com quase um terço feito de plástico reciclável, o controle remoto Eco, além de prático, moderno e leve, ainda é pensado para causar o mínimo de impacto no meio ambiente. Embalagem reutilizável - Abuse da criatividade e cuide do meio ambiente Estamos intensificando nosso compromisso com a sustentabilidade com nossas novas embalagens ecológicas. Utilizamos menos papel e tinta para as caixas das TV, que podem ser transformadas em utensílios domésticos, como uma prateleira de livros, uma casinha de gatos, caixa de ferramenta e muitos outros. Você pode encontrar as instruções criativas, acessando o QR-code da própria embalagem.",7892509117920,"Smart TV Samsung UHD Processador Crystal 4K 58AU7700 Tela sem limites Visual Livre de Cabos 58"" 58""",https://www.amazon.com.br/Samsung-Processador-Crystal-58AU7700-limites/dp/B09QW6CCVQ,"smart tv samsung uhd processador crystal 4k 58au7700 tela sem limites visual livre de cabos 58"" 58""",amazon,Todas as informações divulgadas são de responsabilidade do fabricante/fornecedor.Verifique com os fabricantes do produto e de seus componentes eventuais limitações à utilização de todos os recursos e funcionalidades. Imagens Meramente Ilustrativas.,7892509117920,"Samsung Smart Tv 58"" Uhd 4k 58au7700, Processador Crystal 4k, Tela Sem Limites, Visual Livre De Cabos, Alexa Built In.",https://www.americanas.com.br/produto/3069544778,"samsung smart tv 58"" uhd 4k 58au7700, processador crystal 4k, tela sem limites, visual livre de cabos, alexa built in.",americanas,tvs,1
"Samsung Smart TV Crystal UHD 4K 2020 TU7000 65"", Borda ultrafina, Controle Remoto Único, Bluetooth",7892509113458,"Samsung Smart TV 65"" Crystal UHD 65TU7000 4K 2020, Wi-fi, Borda Infinita, Controle Remoto Único, Visual Livre de Cabos, Bluetooth,  Processador Crystal 4K",https://www.americanas.com.br/produto/1618046756,"samsung smart tv 65"" crystal uhd 65tu7000 4k 2020, wi-fi, borda infinita, controle remoto único, visual livre de cabos, bluetooth,  processador crystal 4k",americanas,"Tipo de produto: LED Série: 7 Tela Tamanho da tela: 75"" Resolução: 3,840 x 2,160 Video Mecanismo de imagem: uhd Engine Clear Motion Rate: 120 Frequência da tela (Hz): 60 pqi (Picture Quality Index): 1300 hdr (High Dynamic Range): hdr Premium hdr 10 +: Sim hlg (Hybrid Log Gamma): Sim Contraste: Mega Contraste Tecnologia de Painel: Pur Color Micro Dimming: Esmaecimento uhd Contrast Enhancer: Sim Auto Motion Plus: Sim Modo Filme: Sim Modo Natural: Sim áudio Dolby Digital Plus: Sim Potência (rms): 20W Tipo de alto-falante: 2 Canais Multiroom Link: Sim Smart Service Samsung smart tv: Smart Bixby: Não Navegador (Web Browser): Sim Convergência Espelhamento do Smartphone para tv, dlna: Sim 360 Video Player: Sim WiFi Direct: Sim Suporte à camera 360: Sim Sintonizador e transmissão Sintonizador analógico: Sim (Trinorma) Digital Broadcasting: isdb-t Data Broadcasting: ginga Conectividade hdmi: 3 usb: 2 Entrada de Componente (y, Pb, Pr): 1 Entrada de Composto (av): 1 (Uso Normal por Componente y) Ethernet (lan): Sim Saida de áudio Digital (óptica): 1 Entrada de rf (terrestre/entrada de cabo): 1 / 1 (Uso Normal para o Terrestre) / 0 hdmi A / Return Ch. Support: Sim hdmi Quick Switch: Sim Rede sem fio integrada: Sim Anynet + (hdmi-cec): Sim Design Design: Visual Livre de cabos Tipo de Borda: vnb Espessura: Ultra Slim Cor frontal: Charcoal Black Tipo de suporte: Pés em L Recurso adicional Instant On: Sim Processador: Quad Core Acessibilidade: Guia de Voz e Aprenda a mexer no Menu (Inglês - Estados Unidos, Português - Brasil)/Ampliar/Aumento de contraste/Aprenda a mexer no Controle Remoto da TV (Inglês - Estados Unidos, Portugues - Brasil)/Cores Negativas/SeeColors Digital Clean View: Sim Busca automática de canais: Sim Desligamento automático: Sim Legenda: Sim Connect Share? (hdd): Sim ConnectShare? (usb 2.0): Sim epg: Sim Game Mode: Sim (Básico) Idioma: Idioma local Compativel com hid usb: Sim IPv6 Support: Sim Recursos Ecológicos Sensor ecológico: Sim Selo Procel: A Alimentação Fonte de energia: AC100-240V 50/60Hz Consumo de Energia (Médio por mês): n/a Dimensões (Larg. x Alt. x Prof. ) Tamanho da embalagem (LxAxP): 1871 x 1131 x 234 mm Tamanho da TV com suporte (LxAxP): 1684.6 x 1056.5 x 356.1 mm Tamanho da TV sem suporte (LxAxP): 1684.6 x 966.4 x 60.6 mm Peso Peso com embalagem: 49.3 kg Peso do conjunto com suporte: 37.5 kg Peso do conjunto sem suporte: 37 kg Acessórios Modelo de controle remoto: TM1640A Baterias (para controle remoto): Sim Compativel com Suporte de Parede Padrão vesa: Sim Manual do usuário: Sim Manual eletrônico: Sim Cabo de força: Sim",7892509113458,TV 65P Samsung LED smart 4K Wifi USB hdmi - UN65TU7000GXZD,https://www.americanas.com.br/produto/2149359214,tv 65p samsung led smart 4k wifi usb hdmi - un65tu7000gxzd,americanas,tvs,1
"Com a Tela 32 Polegadas HD Smart Toshiba, você terá realidade além dos pixels! O sistema operacional vidaa é fluído, amigável e customizável, uma das mais rápidas do mercado e com muitos conteúdos para desfrutar. Vivencie uma experiência sem igual de imersão em som, com a Dolby Audio. Acompanha um controle remoto completo, tenha tudo o que precisa em suas mãos com botões Netflix, Youtube, Amazon Prime, entre outros que vão garantir uma experiência única e fácil. Estabeleça regras digitais e controle os conteúdos impróprios de acordo com a faixa desejada através da função de controle parental. Com bordas infinitas. Acompanha acessório conversor de canais de tv digital externo (dtv). Imagens meramente ilustrativas.",7908414421110,Tela Toshiba 32 Pol. 32v35kb Dled Hd Smart Vidaa - TB007,https://www.americanas.com.br/produto/4515038956,tela toshiba 32 pol. 32v35kb dled hd smart vidaa - tb007,americanas,"Com a Tela 32 Polegadas HD Smart Toshiba, você terá realidade além dos pixels! O sistema operacional vidaa é fluído, amigável e customizável, uma das mais rápidas do mercado e com muitos conteúdos para desfrutar. Vivencie uma experiência sem igual de imersão em som, com a Dolby Audio. Acompanha um controle remoto completo, tenha tudo o que precisa em suas mãos com botões Netflix, Youtube, Amazon Prime, entre outros que vão garantir uma experiência única e fácil. Estabeleça regras digitais e controle os conteúdos impróprios de acordo com a faixa desejada através da função de controle parental. Com bordas infinitas. Acompanha acessório conversor de canais de tv digital externo (dtv). Especificações Marca: Toshiba Referência: TB007 Tamanho da tela: 32 polegadas Resolução da tela: 1366X768 (hd) Contraste: 3000:1 Brilho: 189cd/m² Tempo de resposta: 8 ms Modo de som: dolby audio Processador: Quad Core Frequência do painel: 60Hz Conteúdo Smart: netflix/ prime videos/ youtube/ kids/ loja de app Espellhamento de tela Entrada hdmi Garantia do Fornecedor: 12 meses contra defeitos de fabricação Validade: Indeterminada Itens Inclusos 01 Tv smart 32"" 01 Kit acessórios 01 Kit base (2 pés) Peso e Dimensões Aproximadas do produto na caixa: Largura: 15 cm. Altura: 52 cm. Comprimento: 82 cm. Peso: 5700g. As cores podem variar entre as imagens mostradas acima e o produto. Imagens meramente ilustrativas. Só comercializamos produtos novos, originais e lacrados em caixa.",7908414421110,Smart Tv HD 32 TB007 - Toshiba,https://www.americanas.com.br/produto/4754304879,smart tv hd 32 tb007 - toshiba,americanas,tvs,1
"Smart TV LG 55 LED 4K Wi-Fi Bluetooth hdr Thinq ai Google Assis. Alexa - 55UP751C0SF Real 4K uhd Imersão Surreal As TVs LG uhd sempre superam as expectativas. Experimente qualidade de imagem realista e cores vivas com quatro vezes mais precisão de pixels do que em Full hd. Desempenho arrasador garantido Leve o cinema para casa. filmmaker mode e hdr proporcionam uma experiência de visualização mais imersiva. Fique conectado com sua plataforma de streaming preferida para acessar o conteúdo que você adora. Experiência esportiva emocionante Conecte facilmente suas caixas de som bluetooth para uma verdadeira experiência de som surround sem fios. E com o Alerta Esportivo você vai saber quando seu time está jogando. Nunca perca um jogo da sua equipe. O Alerta de Esportes traz notificações dos seus jogos favoritos diretamente na tela da sua tv. Não se preocupe em perder os melhores lances, mesmo quando estiver assistindo outro conteúdo. Uma nítida vantagem para o time de casa. Conecte facilmente suas caixas de som bluetooth para uma verdadeira experiência de som surround sem fios. Todas as cenas com um som mais rico e mais realista, levando a atmosferta dos grandes jogos até a sua sala. A sua TV com a central de controle dos seus produtos inteligentes A inteligência artificial Al ThinQ permite comandar e controlar de forma mais simples o seu ecossistema de produtos loT. O controle é feito por reconhecimento de voz com o Google Assistente e a Amazon Alexa integrados, você pode controlar sua casa inteligente da sua TV LG NanoCell com a sua voz e ainda acessar mais rapidamente os seus conteúdos favoritos. Especificações Geral Tamanho da tela: 55 Resolução: 4K uhd Tipo de Painel: lcd/led Processador: Quad Core 4K Painel ips: Sim Funcionalidades Sistema Operacional: webOS 6.0 Google Assistente Built-In: Sim Alexa Works-With: Sim Works with Apple AirPlay2: Sim ocf: Sim Conteúdos 360 vr: Sim LG Content Store: Sim Thinq Al: Sim Alexa Built-In: Sim Works witth Apple HomeKit: Sim Painel de Controle: Sim hgig: Sim Musica Player: Sim Miracast Overlay: Sim Imagem Frequência Nativa: 60Hz HDR10: Sim Upscaler: 4K Upscaler dtv: Sim filmmaker mode: Sim Áudio Canais: 2.0 Al Sound: Al Sound Surround: Ultra Surround Potência (rms): 20W Al Acoustic Tuning: Sim Conexões Entrada hdmi 2.0: 2 Entrada rf: 1 Bluetooth In/Out: Sim Entrada usb: 1 Saída Digital Óptica: 1 Itens Inclusos Controle Remoto: Convencional Parafusos: Sim Cabo de força: Sim Manual em Português: Sim Informações Técnicas Produto c/Base (Kg): 14.4 Peso com Caixa (Kg): 19.4 Dimensão c/base (LxAxP) (mm): 1244 x 783 x 235 Alimentação: ac 100-240V - 50/60Hz Consumo Médio (w): 160W Consumo Standby (w): 1 Furacão vesa: 300 x 300 Formato da Base: 2 Pole Imagens de caráter ilustrativo Informações divulgadas de acordo com o manual do fabricante Em caso de duvidas sobre informações técnicas, utilização, limitações e manuseio do produto, verifique o manual do fabricante. ean: 7893299916908 NAC010133",7893299916908,Smart TV LG 55 LED 4K Wi-Fi Bluetooth hdr Thinq ai Google Assis. Alexa - 55UP751C0SF. BWZ,https://www.americanas.com.br/produto/4777755496,smart tv lg 55 led 4k wi-fi bluetooth hdr thinq ai google assis. alexa - 55up751c0sf. bwz,americanas,"Real 4K UHD, SMART TV webOS 6.0, HDR, Inteligência Artificial LG ThinQ, Amazon Alexa built-in e works with, Google Assistente built-in, Apple Airplay & HomeKit, Painel de Controle, Controle Remoto Smart Magic, Modo Hotel",7893299916908,SMART TV LG 4K 55UP751C 55,https://www.amazon.com.br/TV-SMART-LG-UHD-55UP751C/dp/B09H3N2LD1,smart tv lg 4k 55up751c 55,amazon,tvs,1
Todas as informações divulgadas são de responsabilidade do fabricante/fornecedor. Verifique com os fabricantes do produto e de seus componentes eventuais limitações à utilização de todos os recursos e funcionalidades.Imagens Meramente Ilustrativas.,7892509117449,"Smart TV 50"" Crystal UHD Samsung 4k 50AU8000 Painel Dynamic Crystal Color Design Slim Tela Sem Limites",https://www.americanas.com.br/produto/3068486001,"smart tv 50"" crystal uhd samsung 4k 50au8000 painel dynamic crystal color design slim tela sem limites",americanas,"Imagens perfeitas e suaves. Agora, a imagem é reproduzida sem falhas. A taxa de atualização de 75Hz oferece cenas mais fluidas. Seu momento de diversão não tem lag ou efeito fantasma, quer você esteja assistindo a um vídeo ou jogando um jogo.",7892509118903,"Monitor Gamer Samsung 22"" - LF22T350FHLMZD",https://www.amazon.com.br/Samsung-Monitor-22-F22T350FHL-Preto/dp/B09JSZ8VSV,"monitor gamer samsung 22"" - lf22t350fhlmzd",amazon,tvs,0
