descricao_1,ean_1,titulo_1,url_1,titulo_cb_1,loja_1,descricao_2,ean_2,titulo_2,url_2,titulo_cb_2,loja_2,categoria,match
"smart TV LG 55 4K nanocell 55NANO80 4X hdmi 2.0 inteligência artificial thinqai smart magic Repense o que é ser inteligente. Com a TV NanoCell LG as cores são mais vivas e puras, numa distinção imediata dos seus televisores LCDs convencionais. Isso porque suas cores, quando combinadas com a incrível exibição da resolução 4K real, proporcionam imagens com muito mais qualidade e precisão, que aumentam a sua imersão nos conteúdos assistidos. Sua tecnologia se utiliza de nano partículas, para filtrar e refinar a cor que chega até você, removendo as impurezas dos comprimentos de onda rgb. Isso faz com que apenas cores puras e precisas sejam exibidas na tela. O resultado você já sabe: imagens muito mais reais e vibrantes, para você se sentir dentro da ação! Tudo isso movido com o processador a5, que remove ruídos gráficos, acentua o contraste e cria cores muito mais vibrantes, além de redimensionar imagens de baixa resolução, para que sejam reproduzidas com qualidade próxima à das imagens em 4K. Tudo em um só lugar Com a a NanoCell 55"" você tem todos os seus Apps favoritos em um só lugar. Acesse Netflix, Disney +, Apple TV e Amazon Prime Video, escolha entre os mais recentes filmes, programas de tv, documentários e esportes ao vivo e encontre todos eles na hora em que quiser. O novo mouse da sua tv Com o Controle Smart Magic você tem tudo a um clique de distância. Ele tem formato ergonômico, e é super fácil de segurar. Seu sistema de apontar e rolar deixa a pesquisa mais rápida, enquanto a ia integrada oferece fácil acesso a serviços. Além de tudo isso, agora você tem o Magic Tap, um novo recurso inteligente que conecta o telefone à tv. E se tudo isso já não bastasse, com esse modelo, você transforma a sua TV em uma central de controle dos seus produtos inteligentes. Sim, porque a ThinQ ai, inteligência artificial da lg, te permite controlar e comandar de forma simplificada todo o seu ecossistema de produtos IoT (Internet of Things), através de reconhecimento natural de voz. Com o Google Assistente e a Amazon Alexa integrados, você pode controlar sua casa inteligente da sua TV LG NanoCell com a sua voz e ainda acessar mais rapidamente os seus conteúdos favoritos. Pensou que entendia de Smart TVs? Pense de novo.Controle remoto Sim Conversor para TV digital integrado sim Óculos 3D Não Wi-Fi integrado SimImagem - Real 4K - Nano Cores - Nano Contraste - Local Dimming - Nano Detalhes - Processador Alpha 5 - ai Brightness - 4K Upscaling - filmmaker modetm - Active hdr - HGiG - Image Enhancing - Double Step Noise Reduction - Advanced Color Enhancer - True Color Accuracy (17x17x17) Som - 2.0 Ch. / 20W - ai Sound - Bluetooth Surround Ready - ai Acoustic Tuning - Clear Voice iii - Sound Share - TV Sound Mode Share - e-ARC (hdmi 2) ai & Smart - LG ThinQAI - Google Assistente(Built in) - Amazon Alexa (Built in & Works With) - Airplay2 & Homekit(Works with) - Painel de Controle - Sports Alert - Processamento Natural de Linguagem - ai Recommendation - Controle Smart Magic - Otimizador de Games - LG Channels - Edição Inteligente de Apps - Media Player Informações Técnicas - Furação vesa: 300*300 - Peso Produto (c/ base): 16,7 Kg - Peso Produto (s/ base): 16,3 Kg - Peso Caixa: 21,2 Kg - Dimensões Produto (c/ base): 1233*781*257 - Dimensões Produto (s/ base): 1233*716*44,2 - Dimensões Caixa (externa): 1363*816*147 - Alimentação: ac 100-240V 50/60Hz - Sistema de Cores: ntsc, pal-m/n, sbtvd - Consumo Médio: 165W - Consumo Standby: < 0,5W Timer On Não Tecnologia da Tela NanoCell Timer Off Sim Formato da Tela Plana Estéreo Sim Função sap Sim Sistema operacional WebOS Entrada usb 2 Entrada hdmi 4 Tamanho da tela 55"" Conexões - 4 Entradas hdmi 2.0 - 2 Entradas usb - 1 Entrada rf - 1 Saída digital óptica",7893299915772,Smart Tv Lg 55 4k Nanocell 55nano80 4x Hdmi 2.0 Inteligência Artificial Thinqai Smart Magic,https://www.americanas.com.br/produto/4295927831,smart tv lg 55 4k nanocell 55nano80 4x hdmi 2.0 inteligência artificial thinqai smart magic,americanas,"LG TV Nanocell 4k 55 Smart uhd 55NANO80SPA Prepare-se para um mundo de facilidades nesta Smart TV da lg! O modelo 55NANO80SPA possui resolução 4K uhd, para oferecer uma experiência com imagens mais reais e cores mais vivas, garantindo um realismo impressionante. A tecnologia da tela Nanocell permite uma imersão verdadeira, onde quer que você esteja sentado. A combinação perfeita para a sua decoração, pois este produto conta com uma tela de 65"", elevando o design da sua casa para outro patamar. Informações técnicas Marca: lg Modelo: 55NANO80SPA Polegadas: 55"" Resolução: 4K uhd Tecnologia: Nanocell Recursos de vídeo Real 4K Nano Cores Nano Contraste Local Dimming Nano Detalhes Processador Alpha 5 ai Brightness 4K Upscaling filmmaker modetm Active hdr HGiG Consumo (KW/h): 165W Recursos de Áudio: 2.0 Ch. / 20W ai Sound Bluetooth Surround Ready ai Acoustic Tuning Clear Voice iii Sound Share TV Sound Mode Share e-ARC (hdmi 2) Conectividade Wi-fi e Bluetooth Conexões -4 Entradas hdmi 2.0 - 2 Entradas usb - 1 Entrada rf - 1 Saída Digital Optica Processador: Processador Alpha 5 Controle remoto: Smart Magic Assistente virtual-: Google; Alexa Recursos exclusivos da marca: thinq ai Som Potência dos alto: falantes 20W sap - Sim Smart tv - Aplicativos pré-instalados - ThinQ ai - Google Assistente - YouTube -Netflix - Amazon Prime Video Sleep timer - Sim Bloqueio de canais - Sim Energia Voltagem - Bivolt Consumo médio - 200W Cor: Preto Dimensões -Peso do produto: 16,7kg -Dimensões do produto - cm (AxLxP): 87,1x123,3x25,7 Garantia Prazo de Garantia: 01 ano (3 meses de garantia legal e mais 9 meses de garantia especial concedida pelo fabricante). Conteúdo da embalagem tv Base Smart Magic Cabo de força Parafusos Manual A imagem do produto é meramente ilustrativa. Reservamo-nos o direito de qualquer erro de digitação.",7893299915772,LG TV Nanocell 4k 55 Smart uhd 55NANO80SPA,https://www.americanas.com.br/produto/4651284027,lg tv nanocell 4k 55 smart uhd 55nano80spa,americanas,tvs,1
Todas as informações divulgadas são de responsabilidade do fabricante/fornecedor. Verifique com os fabricantes do produto e de seus componentes eventuais limitações à utilização de todos os recursos e funcionalidades. Imagens Meramente Ilustrativas.,7893299915772,Smart TV LED 55” LG 55NANO80 4K NanoCell 4x Hdmi 2.0 Inteligência Artificial Thinqai Smart Magic Google Alexa,https://www.americanas.com.br/produto/3280459712,smart tv led 55” lg 55nano80 4k nanocell 4x hdmi 2.0 inteligência artificial thinqai smart magic google alexa,americanas,"smart TV LG 55 4K nanocell 55NANO80 4X hdmi 2.0 inteligência artificial thinqai smart magic Repense o que é ser inteligente. Com a TV NanoCell LG as cores são mais vivas e puras, numa distinção imediata dos seus televisores LCDs convencionais. Isso porque suas cores, quando combinadas com a incrível exibição da resolução 4K real, proporcionam imagens com muito mais qualidade e precisão, que aumentam a sua imersão nos conteúdos assistidos. Sua tecnologia se utiliza de nano partículas, para filtrar e refinar a cor que chega até você, removendo as impurezas dos comprimentos de onda rgb. Isso faz com que apenas cores puras e precisas sejam exibidas na tela. O resultado você já sabe: imagens muito mais reais e vibrantes, para você se sentir dentro da ação! Tudo isso movido com o processador a5, que remove ruídos gráficos, acentua o contraste e cria cores muito mais vibrantes, além de redimensionar imagens de baixa resolução, para que sejam reproduzidas com qualidade próxima à das imagens em 4K. Tudo em um só lugar Com a a NanoCell 55"" você tem todos os seus Apps favoritos em um só lugar. Acesse Netflix, Disney +, Apple TV e Amazon Prime Video, escolha entre os mais recentes filmes, programas de tv, documentários e esportes ao vivo e encontre todos eles na hora em que quiser. O novo mouse da sua tv Com o Controle Smart Magic você tem tudo a um clique de distância. Ele tem formato ergonômico, e é super fácil de segurar. Seu sistema de apontar e rolar deixa a pesquisa mais rápida, enquanto a ia integrada oferece fácil acesso a serviços. Além de tudo isso, agora você tem o Magic Tap, um novo recurso inteligente que conecta o telefone à tv. E se tudo isso já não bastasse, com esse modelo, você transforma a sua TV em uma central de controle dos seus produtos inteligentes. Sim, porque a ThinQ ai, inteligência artificial da lg, te permite controlar e comandar de forma simplificada todo o seu ecossistema de produtos IoT (Internet of Things), através de reconhecimento natural de voz. Com o Google Assistente e a Amazon Alexa integrados, você pode controlar sua casa inteligente da sua TV LG NanoCell com a sua voz e ainda acessar mais rapidamente os seus conteúdos favoritos. Pensou que entendia de Smart TVs? Pense de novo.Controle remoto Sim Conversor para TV digital integrado sim Óculos 3D Não Wi-Fi integrado SimImagem - Real 4K - Nano Cores - Nano Contraste - Local Dimming - Nano Detalhes - Processador Alpha 5 - ai Brightness - 4K Upscaling - filmmaker modetm - Active hdr - HGiG - Image Enhancing - Double Step Noise Reduction - Advanced Color Enhancer - True Color Accuracy (17x17x17) Som - 2.0 Ch. / 20W - ai Sound - Bluetooth Surround Ready - ai Acoustic Tuning - Clear Voice iii - Sound Share - TV Sound Mode Share - e-ARC (hdmi 2) ai & Smart - LG ThinQAI - Google Assistente(Built in) - Amazon Alexa (Built in & Works With) - Airplay2 & Homekit(Works with) - Painel de Controle - Sports Alert - Processamento Natural de Linguagem - ai Recommendation - Controle Smart Magic - Otimizador de Games - LG Channels - Edição Inteligente de Apps - Media Player Informações Técnicas - Furação vesa: 300*300 - Peso Produto (c/ base): 16,7 Kg - Peso Produto (s/ base): 16,3 Kg - Peso Caixa: 21,2 Kg - Dimensões Produto (c/ base): 1233*781*257 - Dimensões Produto (s/ base): 1233*716*44,2 - Dimensões Caixa (externa): 1363*816*147 - Alimentação: ac 100-240V 50/60Hz - Sistema de Cores: ntsc, pal-m/n, sbtvd - Consumo Médio: 165W - Consumo Standby: < 0,5W Timer On Não Tecnologia da Tela NanoCell Timer Off Sim Formato da Tela Plana Estéreo Sim Função sap Sim Sistema operacional WebOS Entrada usb 2 Entrada hdmi 4 Tamanho da tela 55"" Conexões - 4 Entradas hdmi 2.0 - 2 Entradas usb - 1 Entrada rf - 1 Saída digital óptica",7893299915772,Smart Tv Lg 55 4k Nanocell 55nano80 4x Hdmi 2.0 Inteligência Artificial Thinqai Smart Magic,https://www.americanas.com.br/produto/4295927831,smart tv lg 55 4k nanocell 55nano80 4x hdmi 2.0 inteligência artificial thinqai smart magic,americanas,tvs,1
"Conte com uma tela de 39'' HD de alta resolução, proporcionando uma imersão total ao conteúdo em reprodução. Além de uma velocidade de resposta incrível. Com a função DNR, possui Granulação reduzida, com imagens mais claras e nítidas, te oferece imagens nítidas e vivas para você ter uma experiência surpreendente. Aproveite diversos conteúdos, você também consegue reproduzir conteúdo direto do seu Pen Drive. Possui 2 entradas de HDMI, 1 entrada USB, 1 entrada AV, 1 saída Digital Coaxial e sua alimentação é (Bivolt) 100-220V 60Hz. Imagens Meramente Ilustrativas..",7908414405448,Tela 39 Pol HD sem Conversor Digital Entradas Hdmi + Usb + Av Multilaser – TL033,https://www.amazon.com.br/Tela-Multilaser-sem-Conversor-Digital/dp/B098GQVWJM,tela 39 pol hd sem conversor digital entradas hdmi + usb + av multilaser – tl033,amazon,"Descrição resumidaConte com uma tela de 39 HD de alta resolução, proporcionando uma imersão total ao conteúdo em reprodução. Além de uma velocidade de resposta incrível.Características - Marca: Multilaser - Modelo: TL033Especificações - Smart TV Não - Tamanho da tela 39 - Resolução 1366x768 - Tecnologia da tela dled - Velocidade do painel 60Hz - vga 0 - Processador n/a - Entrada hdmi 2 - Entrada USB 1 - AV/vídeo 1 - Wi-Fi Não - Espelhamento do smartphone Não - Espelhamento de áudio Não - Controle remoto Sim - Dimensão do prodto (mm) 885.9510.586.4 - Função dnrGarantia 12 mesesConteúdo da embalagem: - 1 x Tv - 1 x ControlePeso - 7,00Kg",7908414405448,Televisao 39 Polegadas Hd s/ Conversor Digital Tlo33,https://www.americanas.com.br/produto/4800389923,televisao 39 polegadas hd s/ conversor digital tlo33,americanas,tvs,1
"Android TV LED 43"" S615 Full HD HDR com WIFI Bluetooth integrados, 2 HDMI, 1 USB, Controle Remoto com Comando por controle de Voz, Google Assistant e praticamente sem borda",7899968301259,"Android TV 43"" TCL S615 FULL HD HDR",https://www.amazon.com.br/Android-TCL-S615-FULL-HDR/dp/B09MJQ6JF3,"android tv 43"" tcl s615 full hd hdr",amazon,"Smart TV tcl LED 43 full HD android hdr comando de voz 43S615 A tecnologia da Inteligência Artificial e Android TV agora em sua casa, um show de imagem, som e modernidade. Deixe sua sala ainda mais completa! Confira mais detalhes: Conectividade e controle Você poderá controlar tudo com apenas um comando de voz pelo controle remoto, muita praticidade, não é mesmo? Os recursos Smart tv, permitirá que você assista seus filmes, vídeos ou séries na Netflix, Youtube, Prime Vídeo, Globo Play e muito mais. Com a função Bluetooth, conecte vários dispositivos em sua TV ou espelhar os conteúdos para assistir na tela maior. E te mais! Com o Google Assistente e o Google Nest, vai ser possível controlar sua TV através do seu Smartphone! Um verdadeiro cinema! Conte com tecnologia Full hd, que lhe dará imagens de alta qualidade! Ela ainda foi desenvolvida com a expansão de cores vibrantes, micro dimming e hdr, que vão garantir ainda mais brilho e contraste, proporcionando imagens com mais intensidade e realismo, você se sentirá dentro das cenas! Uma obra de arte! Suas bordas minimalistas, finas e metálicas, deixará seu ambiente ainda mais moderno e sofisticado, vai parecer uma moldura em sua parede! Sobre a marca: Revolução Semp tcl! A Semp tcl, está há 77 anos no mercado, sendo uma empresa que vem revolucionando a trajetória da tecnologia brasileira, uma das maiores fabricantes de TV e a primeira a fabricar aparelhos televisores no Brasil. Hoje é líder Global em Android tv. A junção da semp e tcl é o melhor de dois mundos inovando para você. Além disso semp se preocupa com o esporte brasileiro patrocinando a seleção masculina e feminina de futebol e o comitê paralímpico brasileiro, apoiando esses atletas que inspira o Brasil por meio do esporte. Características: Marca: tcl Modelo: 43S615 Smart tv: Sim Tamanho da tela: 43 Resolução: 1920 x 1080 pixels Full hd Tecnologia da tela: led Taxa de atualização: 60 Hz Formato da tela: Plana hdr: Sim Sistema operacional: Android Tipo de alto-falante: 2 canais Potência de áudio total (rms): 20 w Estéreo: Sim Entrada hdmi: 2 Entrada usb: 1 AV/vídeo: Sim Saída digital: óptica1 lan RJ45: Sim Entrada de rf: Sim Bluetooth: Sim Wi-Fi: Sim Comando de voz: Sim (pelo controle remoto) Espelhamento do smartphone: Sim Espelhamento de áudio: Sim Função timer: Sim Controle remoto: Sim Consumo: 75 w Inmetro: Sim Conteúdo da embalagem: 01 tv, 01 controle remoto, 01 cabo de força, manual eletrônico e manual de instruções. Dimensões do Produto Com base: Altura: 62 cm Largura: 96,7 cm Profundidade: 19 cm Peso: 6,8 kg Dimensões do Produto Sem base: Altura: 57 cm Largura: 96,7 cm Profundidade: 8,6 cm Peso: 6,5 kg Garantia: 12 meses (3 meses de garantia legal e mais 9 meses de garantia especial concedida pelo fabricante). Detalhes sobre a compra: Fique de olho: siga sempre as orientações do fabricante e utilize seu produto de acordo com o manual. A empresa não se responsabiliza pelo mau uso do produto, o que pode causar perda da garantia. #8239; Não nos encarregamos, no ato da entrega, por montagens e desmontagens, subir escadas/elevadores ou transporte por guincho para apartamentos. Eventuais despesas são de responsabilidade do cliente. O valor divulgado é unitário e a imagem é meramente ilustrativa. Precisou trocar ou devolver? O prazo é de 7 dias a partir do recebimento do produto - Lei nº 8.078. Sempre confira no ato da entrega.",7899968301259,Smart TV tcl LED 43 Polegadas Full HD Android hdr Comando de Voz 43S615,https://www.americanas.com.br/produto/5019951893,smart tv tcl led 43 polegadas full hd android hdr comando de voz 43s615,americanas,tvs,1
,7892509122467,"Smart TV Samsung 60"" QLED 4K Q65B 2022 Design Air Slim, Processador Quantum Lite, Multitela 60""",https://www.amazon.com.br/Samsung-Design-Processador-Quantum-Multitela/dp/B0B1W74GN4,"smart tv samsung 60"" qled 4k q65b 2022 design air slim, processador quantum lite, multitela 60""",amazon,"Modelo: QN60Q65BAGXZD Tecnologia de Pontos Quânticos10 anos de garantia contra Burn inSom em Movimento Desfrute o máximo da qualidade de imagem em 4K, com 1 bilhão de cores vibrantes por muito mais tempo. Surpreenda os seus adversários dominando a partida em uma TV que proporciona mais fluidez a cada cena. A experiência do som 3D permitirá que você fique totalmente imerso no áudio dos seus filmes e séries, como se estivesse no meio da ação. Experimente uma imersão incrível nos seus programas favoritos com uma TV superfina de apenas 2,5cm de espessura e sem bordas aparentes. Com o novo Smart Hub você gasta menos tempo pesquisando e mais tempo assistindo a programas que você gosta, graças à experiência otimizada de pesquisa, que sugere conteúdos com base em como você usa sua tv. Tecnologia para oferecer um novo nível de entretenimento em tv. Tenha a melhor visualização do seu game com opções de formato de tela de 21:9 ou 32:9, além de um menu intuitivo para você consultar o input lag, fps, hdr e outras informações importantes com rapidez e realizar ajustes que fazem a diferença na partida. O som da soundbar é somado aos alto-falantes da TV e, diferente das TVs convencionais, ambos trabalham em conjunto para uma experiência sonora única e incomparável. A TV identifica o som e o aprimora de acordo com cada cena do seu conteúdo. Assim você percebe com mais clareza as vozes da cena, até se o volume da TV estiver baixo. Um controle remoto moderno e ecológico, feito de quase um terço de plástico reciclável e que é recarregável por energia solar, pela própria luz ambiente da sua casa ou por usb, evitando o desperdício de milhões de pilhas aaa ao longo dos anos. Controle e monitore toda a sua casa. Acesse o aplicativo SmartThings e transforme sua TV na central de automação controlando os demais aparelhos inteligentes da Samsung ou criando programações de acordo com a sua rotina. Além disso, aparelhos mais antigos, como seu ventilador com controle remoto, são detectados automaticamente e controlados pela tv. Com a TV Samsung, você aproveita não apenas a melhor qualidade de imagem, mas também curte, no conforto da sua casa, diferentes atividades, como acesso a canais gratuitos, videoconferências na tela grande, acesso remoto ao seu pc e conectividade entre aparelhos, além de também poder dividir a tela ao meio com dois conteúdos diferentes. Aproveite! Desfrute de conteúdo de TV gratuito. Escolha entre uma variedade de canais que oferecem conteúdo para todos os interesses. Sem assinatura e sem dispositivos extras. Divida a tela da TV ao meio, o conteúdo a que você está assistindo de um lado e a tela espelhada do seu smartphone do outro. Acesse vídeos, verifique estatísticas de esportes e muito mais, enquanto assiste ao seu programa ou jogo favorito. Controle sua TV por voz em português: acesse apps, mude de canal ou altere o volume. A TV traz Bixby, Alexa e Google Assistant integrados para você escolher o seu serviço de voz preferido. Encoste seu smartphone na TV e veja o conteúdo do seu celular automaticamente espelhado na tela grande para compartilhamento de fotos, vídeos e apresentações. Aquela confusão de controles no seu ambiente acabou. O exclusivo Controle Remoto Único reconhece todos os aparelhos compatíveis conectados à TV e passa a controlá-los também. Estamos intensificando nosso compromisso com a sustentabilidade com nossas novas embalagens ecológicas.",7892509122467,"Smart TV Samsung 60 qled 4K Q65B 2022 Design Air Slim, Processador Quantum Lite, Multitela",https://www.americanas.com.br/produto/5130501920,"smart tv samsung 60 qled 4k q65b 2022 design air slim, processador quantum lite, multitela",americanas,tvs,1
Todas as informações divulgadas são de responsabilidade do fabricante/fornecedor.Verifique com os fabricantes do produto e de seus componentes eventuais limitações à utilização de todos os recursos e funcionalidades. Imagens Meramente Ilustrativas.,7899968301020,"Smart TV Led 65” Tcl P715 4K Android UHD HDR com Wi-Fi e Bluetooth Integrados, Comando de voz à distância, Google Assistant",https://www.americanas.com.br/produto/2120880639,"smart tv led 65” tcl p715 4k android uhd hdr com wi-fi e bluetooth integrados, comando de voz à distância, google assistant",americanas,"Aproveite toda a qualidade de som e imagem da Fast Smart Tv Philco PTV42G10N5SKF D-Led Full HD 42"" diretamente do conforto do sofá da sua casa. Ela possui resolução Full hd, e várias outras configurações e tecnologias que proporcionam a você uma incrível experiência de som e imagem. A resolução Full HD possui 2 milhões de pixels, que resulta em uma maior nitidez de imagem, além de proporcionar cores vivas e vibrantes por toda a tela. Entrada para leitura/gravação de arquivos digitais, através do seu pen-drive ou HD externo. Sendo assim possível reproduzir vídeos, imagens e músicas. A Smart Tv Philco possui processador Quad Core de quatro núcleos de processamento, que garantem um alto desempenho para rodar os seus aplicativos de música, streaming e muitos outros. O Processador Gráfico Triple Core, de três núcleos, trabalha em conjunto com o processador do televisor, isso permite um melhor desempenho de imagens e respostas gráficas. Sistema de som Dolby Digital que transmite o som do filme ou vídeo reproduzido em 5.1 canais. Proporcionando maior clareza sonora e o som surround, que cria uma experiência de som 3D. A Smart Tv Philco possui tecnologia Midia Cast, onde possibilita o espelhamento entre seu dispositivo móvel e o televisor. Procure por seu aplicativo favorito pela nova loja de aplicativos. Aproveite para navegar pela internet, ver vídeos no youtube, assistir suas séries e filmes na Netflix, Globoplay e muito mais! Características: - Imagem de alta definição - USB Multi Media Player - Navegação rápida e fluída - Alto processamento de detalhe - Som cristalino com Dolby Audio - Espelhamento entre dispositivo móvel e sua Smart Tv - Seus apps favoritos em um só lugarEspecificações Técnicas: Marca: PhilcoModelo: PTV42G10N5SKF Voltagem: BivoltCor: PretoPotência: 54,8WConsumo: Tomada: 3APinos: 2Polegadas: 42""Processador: Processador Quad coreProcessador Gráfico: Processador Gráfico Triple CoreResolução: FullHD (1920 X 1080)Tipo de Tela: LEDAndroid: NãoTempo de resposta: 8.0 msÂngulo de Visão: 178°(H) x 178°(V)Brilho: 310 cd/m²Contraste dinâmico: 3.000.000:1Frequência da Tela: 60HzPotência do Alto-Falante: 10Wrms x 2Formato da Tela: 16:9Sistema de cores: pal-m, pal-n, NTSCFuração Vesa: 200x200mmWIFI integrado: SimConexões: Entrada de vídeo e áudio: estéreo (RCA)2 entradas hdmi 1.4 e 1 entrada hdmi 1.4 (ARC)², total de 3 entradasEntrada rf para TV aberta (Digital e Analógica) e TV à cabo2 entradas USB 2.0: reproduz filmes, músicas e fotos1 entrada s/pdif out Optical1 entrada Ethernet1 entrada P2: Para amplificadores e periféricos de áudioMenu nos idiomas Português e InglêsBusca automática de canaisRecepção em atv, dtv e CATVConversor digital integradoEqualizadores de som e imagem: SimAjustes de temperatura de cor: SimNivelador automático de volume: SimRecursos: mute MTS¹ sleep browser app store closed caption dnr GUIDE¹ INFO¹ bloqueiode canal relógio zoom PVR¹ hdmi ARC² T-LINK² (HDMI-CEC). Disponível apenas para transmissões em isdb-t (tv Digital). O dispositivo conectado deve ser compatível com a função. Recurso talvez não funcione com dispositivos de algumasmarcas. Dimensões do produto com base: 57,9 x 95,1 x 23 cmDimensões do produto sem base: 54 x 95,1 x 8,7 cmPeso do produto com base: 6,20KgPeso do produto sem base: 5,74KgDimensões da Embalagem: 64,5 x 106,2 x 14,5 cmPeso Bruto: 7,64KgGarantia: 12 MesesConteudo da embalagem:01 Smart Tv Philco 42"" D-Led Full HD PTV42G10N5SKF Preto Bivolt01 Controle remoto01 Cabo de alimentação AC01 Manual de Instruções em PortuguêsParafusos da base e Base",7891356094859,Smart Tv Philco 42 D-Led Full HD PTV42G10N5SKF Preto Bivolt,https://www.americanas.com.br/produto/4954656385,smart tv philco 42 d-led full hd ptv42g10n5skf preto bivolt,americanas,tvs,0
